,Unnamed: 0,artist,track,genres,lyrics
67,67,Dierks Bentley,Come A Little Closer,"['contemporary country', 'country', 'country road']","[Chorus]
Come a little closer, baby
I feel like laying you down

[Verse 1]
On a bed sweet surrender
Where we can work it all out
There ain't nothing that love can't fix
Girl, it's right here at our fingertips

[Chorus]
Come a little closer, baby
I feel like laying you down

[Verse 2]
Come a little closer, baby
I feel like letting go
Of everything that stands between us
And the love we used to know
I wanna touch you like a cleansing rain
Let it wash all the hurt away

[Chorus]
Come a little closer, baby
I feel like laying you down
[Verse 3]
If there's still a chance
Then take my hand
And we'll steal away
Off into the night
'till we make things right
The suns gonna rise on a better day

Come a little closer baby
I feel like stripping it down
Back to the basics of you and me
And what makes the world go round
Every inch of you against my skin
I wanna be stronger than we've ever been

[Chorus]
Come a little closer, baby
I feel like laying you down

[Outro]
Come a little bit closer baby
Just a little bit closer baby
Come a little bit closer baby
I feel like laying you down1EmbedShare URLCopyEmbedCopy"
68,68,Bilal,Soul Sista,"['hip hop', 'indie soul', 'neo soul', 'urban contemporary', 'funk', 'hip hop', 'neo soul', 'r&b', 'soul', 'urban contemporary']","[Intro]
Hey sis, sista

[Verse 1]
It's all in her eyes, you and me
Words just disguise all the things that you be
What is deep? Steeper than steep
Soul only knows, this type of vibe gets stronger in time

[Verse 2]
Won't go on unnoticed, so concrete can't hold this
Hearts filled righteously
Whatever it is, I know that it's real
Long as you know, no complaints, you're all that I feel

[Chorus]
Sista soul (You must be my soul sista, soul sista)
Sista soul (Hey sis, you must be my soul sista, soul sista)
Sista soul (Hey sis, you must be my soul sista)
Sista soul

[Verse 3]
You are so fine
Like spaces that fall in my soul, see, baby, that has no rhyme
Do you like how it feels when I smoke you out head down to your toes?
Making you, making you scream and shout
[Chorus]
You must be my soul sista, soul sista, you my (Sista soul)
You must be my soul sista, soul sista, you my (Sista soul)
You must be my soul sista, soul sista, you my (Sista soul)
You must be my soul sista, soul sista, hey (Sista soul)
Sista soul (Yeah, uh)
You must be my soul sista (Sista soul), sista, sista, sista soul

[Outro]
Sista soul, sista soul, sista soul, hey, baby
Can I love you in the right way, please?
Soul, hold, baby, I want to love
You know, baby, I want to love in the right way
Hold you 'cause you're my soul sista, baby, you are my sista
All I wanna do is love you in the right way
Hold you on, 'cause baby, you are my soul sista
Soul, love you in the right way, you're my, hey, hey, hey
You're my soul sista, you're my, hey, hey, hey, hey (Ooh-ooh-ooh)
Soul sista, hey, my soul sista, soul
You're my soul sista, hey, yeah, yeah
I wanna love you in the right way
Hold you, don't you know what I say?
Told you, baby, don't you know?
You're my soul sista, hey
You're gonna really know it
You're, baby, I want it, I want it
Oh, gimme, gimme
Oh, oh, oh, baby3EmbedShare URLCopyEmbedCopy"
69,69,Mandy Moore,I Wanna Be With You,"['dance pop', 'hollywood', 'movie tunes', 'pop', 'post-teen pop', 'show tunes']","[Verse 1]
I try, but I can't seem to get myself to think of anything but you
Your breath on my face, your warm gentle kiss, I taste the truth
I taste the truth

[Pre-Chorus]
You know what I came here for
So I won't ask for more

[Chorus]
I wanna be with you
If only for a night
To be the one who's in your arms who holds you tight
I wanna be with you
There's nothing more to say
There's nothing else I want more than to feel this way
I wanna be with you

[Verse 2]
So I'll hold you tonight like I would if you were mine
To hold forever more
And I'll savor each touch that I wanted so much to here before
To feel before

[Pre-Chorus]
How beautiful it is
Just to be like this
[Chorus]
I wanna be with you
If only for a night
To be the one who's in your arms who holds you tight
I wanna be with you
There's nothing more to say
There's nothing else I want more than to feel this way
I wanna be with you

[Bridge]
Oh, baby
I can't fight this feeling anymore
It drives me crazy when I try to
So call my name
Take my hand
And make my wish
Baby, your command

[Chorus]
Yeah
I wanna be with you
There's nothing more to say
There's nothing else I want more than to feel this way
(I wanna be) I wanna be with you (I wanna be with you)
I wanna be with you
Wanna be with you (Yeah)
(I wanna be with you) I wanna be
I wanna be with you
(I wanna be)
(I wanna be)
(I wanna be with you) Yeah
(I wanna be with you)
I wanna be, I wanna be, baby
I wanna be
(I wanna be with you)
I wanna be with you, yeah
I wanna be with you1EmbedShare URLCopyEmbedCopy"
70,70,Daft Punk,One More Time,"['electro', 'filter house']","[Produced by Daft Punk]

[Intro: Romanthony]
One more time
One more time

[Chorus 1: Romanthony]
One more time
We're gonna celebrate
Oh yeah, all right
Don't stop the dancing
One more time
We're gonna celebrate
Oh yeah, all right
Don't stop the dancing
One more time
We're gonna celebrate
Oh yeah, all right
Don't stop the dancing
One more time
We're gonna celebrate
Oh yeah
One more time

[Interlude]
[Chorus 1: Romanthony]
One more time
We're gonna celebrate
Oh yeah, all right
Don't stop the dancing
One more time
We're gonna celebrate
Oh yeah
Don't stop the dancing
One more time

[Bridge: Romanthony]
Mmm, you know I'm just feeling
Celebration tonight
Celebrate
Don't wait too late
Mmm, no
We don't stop
You can't stop
We're gonna celebrate
One more time
One more time
One more time
Celebration
You know we're gonna do it right, tonight
Hey! Just feeling
Music's got me feeling the need
Need, yeah
Come on, all right
We're gonna celebrate
One more time
Celebrate and dance so free
Music's got me feeling so free
Celebrate and dance so free
One more time
Music's got me feeling so free
We're gonna celebrate
Celebrate and dance so free
One more time
Music's got me feeling so free
We're gonna celebrate
Celebrate and dance so free
One more time
Music's got me feeling so free
We're gonna celebrate
Celebrate and dance so free
One more time
Music's got me feeling so free
We're gonna celebrate
Celebrate and dance so free
One more time
Music's got me feeling so free
We're gonna celebrate
Celebrate and dance so free
[Chorus 2: Romanthony]
One more time
Music's got me feeling so free
We're gonna celebrate
Celebrate and dance so free
One more time
Music's got me feeling so free
We're gonna celebrate
Celebrate and dance so free
One more time
Music's got me feeling so free
We're gonna celebrate
Celebrate and dance so free
One more time
Music's got me feeling so free
We're gonna celebrate
Celebrate and dance so free
One more time
Music's got me feeling so free
We're gonna celebrate
One more time
Music's got me feeling so free
We're gonna celebrate
Celebrate and dance so free
One more time
Music's got me feeling so free
We're gonna celebrate
Celebrate and dance so free
[Pause]

[Chorus 2: Romanthony]
One more time
Music's got me feeling so free
We're gonna celebrate
Celebrate and dance so free
One more time
Music's got me feeling so free
We're gonna celebrate
Celebrate and dance so free
One more time
Music's got me feeling so free
We're gonna celebrate
Celebrate and dance so free
One more time
Music's got me feeling so free
We're gonna celebrate
Celebrate and dance so free36EmbedShare URLCopyEmbedCopy"
71,71,Nelly Furtado,I'm Like A Bird,"['canadian latin', 'canadian pop', 'dance pop', 'pop', 'pop rap']","[Verse 1]
You're beautiful, that's for sure
You'll never ever fade
You're lovely, but it's not for sure
That I won't ever change

[Pre-Chorus]
And though my love is rare
Though my love is true

[Chorus]
I'm like a bird, I'll only fly away
I don't know where my soul is (Soul is)
I don't know where my home is
And baby, all I need for you to know is
I'm like a bird, I'll only fly away
I don't know where my soul is (Soul is)
I don't know where my home is
All I need for you to know is

[Verse 2]
Your faith in me brings me to tears (Oh)
Even after all these years, years
And it pains me so much to tell
That you don't know me that well
[Pre-Chorus]
And though my love is rare
Though my love is true

[Chorus]
I'm like a bird, I'll only fly away
I don't know where my soul is (Soul is)
I don't know where my home is
And baby, all I need for you to know is
I'm like a bird, I'll only fly away
I don't know where my soul is (Soul is)
I don't know where my home is
And baby, all I need for you to know is

[Bridge]
It's not that I wanna say goodbye
It's just that every time you try
To tell me, me that you love me (Oh-oh)
Each and every single day
I know I'm gonna have to eventually
Give you away

[Breakdown]
And though my love is rare, rare, rare
And though my love is true, yeah
Hey, I'm just scared
That we may fall through
Yeah, yeah-yeah, yeah, yeah
[Chorus]
I'm like a bird (I'm like a bird)
I don't know where my soul is (Soul is)
I don't know where my home is
And baby, all I need for you to know is
I'm like a bird, I'll only fly away
I don't know where my soul is (Soul is)
I don't know where my home is
And baby, all I need for you to know is
I'm like a bird, I'll only fly away
(I don't know where my soul is)
I don't know where my soul is (Soul is)
(I don't know where my home is, oh)
I don't know where my home is
And baby, all I need for you to know is
I'm like a bird, I'll only fly away
(I don't know where my soul is)
(I don't know where my home is)
I don't know where my soul is (Soul is)
I don't know where my home is
And baby, all I need for you to know is

[Outro]
I'm like a bird, I'll only fly away
I don't know where my soul is (Soul is)
I don't know where my home is
And baby, all I need for you to know is
I'm like a bird, I'll only fly away
I don't know where my soul is (Soul is)
I don't know where my home is15EmbedShare URLCopyEmbedCopy"
72,72,Terri Clark,Girls Lie Too,"['alberta country', 'canadian contemporary country', 'canadian country', 'contemporary country', 'country', 'country dawn', 'country road', 'country rock']","So she can't go out tonight again
Her sister's sick
She's gotta baby-sit
Yeah, that sounds like a pretty good excuse
Now you didn't hear any of this from me
But things aren't always what they seem
Brace yourself
This may come as a shock to you

Girls lie, too
We don't care how much money you make
What you drive or what you weigh
Size don't matter anyway
Girls lie, too
Don't think you're the only ones
Who bend it, break it, stretch it some
We learn from you
Girls lie, too

We can't wait to hear about your round of golf
We love to see deer heads hanging on the wall
And we like Hooters for their hotwings too
Other guys never cross our minds
We don't wonder what it might be like
How could it be any better than it is with you
Yeah, girls lie, too
We always forgive and forget
The cards and flowers you never sent
Will never be brought up again
Girls lie, too

Old gray sweatpants turn us on
We like your friends and we love your mom
And that's the truth
Girls lie, too
Yeah that's the truth
Girls lie, too

No, we don't care how much hair you have
Yeah, that looks good
Comb it over like thatEmbedShare URLCopyEmbedCopy"
73,73,NB Ridaz Featuring Angelina,Runaway,"['chicano rap', 'latin hip hop']","I would give my life for you
You mean the world to me
Baby baby baby babe
You know I love you (uh huh Come on yea yea)
And I wanna be together when you runaway (Its NB Ryders)
Just me and you (Same Klick new title)
Just you and me
Will you runaway with me

The day I wrote these words for you I cried
Could of died that day a happy and complete man
Cuz in the palm of my hands
Everything that I dreamed for and more
And you know I'm down for yours
Forever and life the reason why I made you my wife is because
You see me for me the real me and love me unconditionally
And even with the circumstances that I had you still gave me a chance
And that's why I live and breathe for you and the kids
And you give me more than what this thing could ever give to me
And now my life is satisfied and complete visions are coming true
Yea of me and you placing rings on each others fingers saying ""I do""
You stuck with me through my thick and my thin to go back and live life over
Again
Nah this is my destiny it was worth the agony to get the ecstasy

(Chorus)
We can runaway and spend some time
I'll always be the one right by your side
Tell the whole world you belong to me
You are my everything
I wanna run away with you
Do do do do do do do do
I never ever met a shorty that was quite like you
And even though it was wrong I fell in love with you
Now we sit here not really knowing what to do
But I'm sure that you know I'll give the world for you
If I could runaway with you I wouldn't even think twice
I promise girl I'll put it all on the line
I know forever seems to be a long time
But thats what I'm seeing when I look into your eyes
And it don't matter what your friends might say
Cuz I know deep inside you feel the same way
You could tell me what u want but I could read your mind
So quit lying to yourself and put ya hand in mine
I get excited everytime you come close
And being right here with you is what I love the most
So any time your feeling lonely inside
We could runaway together and leave this world behind

(Chorus)
We can runaway and spend some time
I'll always be the one right by your side
Tell the whole world you belong to me
You are my everything
I wanna run away with you
Do do do do do do do do

Waking up in the morning and your still not there
Can't we runaway and escape somewhere
Missing your soft touch your lips next to mine
Holdin up your hands as you look in my eyes
What must of happened to the love we both felt inside
Emotions were strong and the feeling was right
Now we don't speak anymore you went your own way
If thats what loves about then I was mislead
Go ahead and take your time if thats what you need
My loves for you forever my heart for you bleeds
Things happen for a reason so I ask my self should I be strong
And wait or move on to someone else
I know you still love me I could feel it inside
You always kept it real no games no lies
If your ever feelin lonely feel the need to get away
Call me up I'll be there together we'll run away girl
(Chorus)
We can runaway and spend some time
I'll always be the one right by your side
Tell the whole world you belong to me
You are my everything
I wanna run away with you
Do do do do do do do doEmbedShare URLCopyEmbedCopy"
74,74,Lou Bega,"Tricky, Tricky",['latin pop'],"She likes bars, she likes diamonds too
She likes stars if they rendezvous
She likes champagne to maintain her style
She likes a man only for a while
She likes access to your bank account
She likes dollars, she likes British pounds
She likes money only in high amounts
Baby is cool she knows what counts

She likes to pay with credit cards
Ride expensive cars, stays in the president suite
And every day she's looking for a man who gives her more
To satisfy her needs

She's soulshaker, troublemaker
She is a heartbreaker
Undertaker, moneymaker
She is a lovefaker

Soulshaker, troublemaker
She is a heartbreaker
Undertaker, moneymaker
She is a lovefaker

Tricky, tricky - but she is pretty, pretty
She is tricky, tricky - but she is pretty pretty
So damn pretty
I like holidays when there is nothing to do
I like fun for free and an ice cold brew
I like to watch football on TV
I like to sleep and wake up around three
I like to hang out with my boys - making lots of noise -
Dancing in a club - there is no choice
She will never understand - that I can be her man -
I am what I am - so damn

She likes to pay with credit cards
Ride expensive cars, stays in the president suite
And every day she is looking for a man who gives her more
To satisfy her needs

She's soulshaker, troublemaker
She is a heartbreaker
Undertaker, moneymaker
She is a lovefaker

Soulshaker, troublemaker
She is a heartbreaker
Undertaker, moneymaker
She is a lovefaker

Tricky, tricky - but she is pretty, pretty
She is tricky, tricky - but she is pretty, pretty
So damn pretty
Tricky, tricky, tricky, tricky
But she is pretty, pretty, pretty, pretty
Tricky, tricky, tricky, tricky
But she is pretty, pretty, pretty, pretty

She's a soulshaker, troublemaker
She is a heartbreaker
Undertaker, moneymaker
She is a lovefaker

Soulshaker, troublemaker
She is a heartbreaker
Undertaker, moneymaker
She is a lovefaker

Tricky, tricky - but she is pretty, pretty
She is tricky, tricky - but she is pretty, pretty
So damn prettyEmbedShare URLCopyEmbedCopy"
75,75,R. Kelly Featuring Keri Hilson,Number One,"['dance pop', 'hip pop', 'pop', 'pop r&b', 'post-teen pop', 'r&b', 'urban contemporary']","[Intro: R. Kelly]
A lot of these cats out here be faking
When it comes to making love
But you and me baby
This is real... and that's why it's...

[Hook: R. Kelly]
(N-N-Number one)
Sex, that we're having here, girl, ooh
(This is, this is number one)
Sex, that we're having here, girl, ooh

[R. Kelly]
You better ask somebody...
Can't nobody do it like us
Can't nobody mix chop and screw it like us
All over the living room hittin' it like us
In the middle of the night, wake up the building like us
But it's oookay if you wanna brag
The sex so good, go and pat yourself on the back
And them haters, they gon' hate
But we just gon' keep on blowing up cause girl, they gon' hate, anyway
You are now rocking with the best (best, best, best...)
I'll make you forget about the rest (rest, rest, rest...)
Having sex with you is like making hits
Girl we got egos they can't tell us that we ain't the shit
And I'm in your mix like a number one record
And the beat goes on and on...
And it don't stop you keep going from the night onto the day (Oh)
And I love it when you take me down and make me say-ay... (Oh)
[Hook: R. Kelly]
(N-N-Number one)
Sex, that we're having here, girl, ooh
(This is, this is number one)
Sex, that we're having here, girl, ooh

[R. Kelly]
Keri!

[Keri Hilson, R. Kelly]
You know you stay at the top spot
When you're breaking me down like a chop shop, eh
Cutting like some blades on a caddy, that's how you're working me, daddy
Everytime you put that on, no, ooh
You are now rocking with the best (best) best (best)
I'll make you forget about your ex (ex, ex, ex...)
This one here's a race where you don't wanna come first
I know what I'm doing ain't no need to rehearse yeah-ee-yeah
A lot of dudes just be going nowhere fast
But you be steady cruising like you want it to last
How you made me a chocoholic, and right now my body's callin'
I gotta know how you got the knowhow (Oh)
Baby you the champ of all that goes down (Oh)
If your dick was a gun it would stone cold?
With my RNB thug when I bang bang
You know Kells and Keri hook up just like that
You make it number one
[Hook: R. Kelly, Keri Hilson]
(N-N-Number one)
Sex, that we're having here, girl, ooh (Girl wow) (Ooh)
(This is, this is number one)
Sex, that we're having here, girl, ooh (Eh) (Sex, that we're having here, ooh boy)

[R. Kelly]
Hands down you the best, ain't no competition (Oh)
You and me in this bed, just what I was wishin'
Them other girls was cool but it's something they was missin'
And I don't call them back every since we hit it in the kitchen
That night, at my home, trench coat, nothin' on
Your sex, got me gone, went straight, to my dome
And I love it (woo-ooh), girl I love it (woo-ooh)
Ooh I love it (woo-ooh), girl I love it (woo-ooh)
Girl it's something about you that thrills me (Oh)
That's why after we lay you get to know the real me-e-e, yeah! (Oh)
And it don't stop you keep going from the night onto the day (Oh)
And I love it when you take me down and make me sayyyyy

[Hook: R. Kelly, Keri Hilson]
(N-N-Number one)
Sex, that we're having here, girl, ooh (Oh yeah) (Ooh whoa)
(This is, this is number one)
Sex, that we're having here, girl, ooh (Ooh yeah)
[Outro: R. Kelly]
Girl I vow that I would do anything to pleasure you
All I wanna do is make this last
I'll kiss you up, I kiss you down, be real quiet, or making sounds
Take it slow or take it fast
And a-woooo, and a-weeee
And a-yooouuu, and me, havin' fun
And when it's over in the morning, I'll say gracias baby
Before you go I'll scream damelo
(N-N-Number one)
(This is, this is number one)4EmbedShare URLCopyEmbedCopy"
76,76,Cassidy Featuring Mashonda,Get No Better,"['battle rap', 'hip hop', 'hip pop', 'philly rap', 'pop rap', 'rap', 'southern hip hop', 'trap', 'hip pop', 'urban contemporary']","(Swizz Beats:)
Ladies and Gentlemen
Swizz, swizz, swizz

Hey ho, hey ho, hey ho, hey ho OK

(Chorus:)
How you doin ma
Dis ya song ma
Yeah come on ma, dis ya song ma
Dis ya song ma
We can get it on ma
Dis ya song ma
Dis ya song ma
Dis ya song

(Cassidy Verse 1:)
How ya doin ma?
Yeah come here ma
Where you goin ma?
What up you in a rush
What's going on ma
You can keep going ma
But in dis cruel world you goin need
A man thats thurl to keep you warm ma
You and me we can take the world by storm ma
So let me have yo math then I'm going ma
I'm having a after party later on ma
So you should cancel whatever you was doing ma
We can get a telly and visit and get it on ma
You wit it, I hit it till six in the morn ma
You ain't hear da song ma
Yeah I'm a don ma so if you ridin'
Wit a playa than come on ma
(Chorus w/ Mashonda:)
How ya doin ma
(oh)
Dis ya song ma
(yeah)
Yeah come on ma
(oh)
Dis ya song Ma
(yeah)
We can get it on ma
(oh)
Dis ya song ma
Dis ya song ma
Dis ya son
(Yeah) yeah, yeah, yeah
Scream at me
Me and you
(it don't get no better)
What we can do
(it don't get no better)
Our love
(it don't get no better)
Cuz you remind me of the first time

(Verse 2:)
Hey you know what you remind me of
The sun that shines above I think that I'm in
Love cuz every time I look in your eyes
They be dumb bright like the sunlight
When I look in the sky and you always look fly
You stay with a mean outfit
And got shoes that didn't even come out yet
Always got your your nails done, always got yourself fixed
You da type of chick I can see me going out wit
And I ain't knockin yo hustle but you should be
Somebody's wifey icey wit a rock on your knuckle
And we would look hot as a couple
Cuz you shaped so beautifully and
You almost as cute as me
How ya doin ma
(oh)
Dis ya song ma
(yeah)
Yeah come on ma
(oh)
Dis ya song Ma
(yeah)
We can get it on ma
(oh)
Dis ya song ma
Dis ya song ma
Dis ya son
(Yeah) yeah, yeah, yeah
Scream at me
Me and you
(it don't get no better)
What we can do
(it don't get no better)
Our love
(it don't get no better)
Cuz you remind me of the first time

(Verse 3:)
Mmmm wit your sexy self go to my hotel
And undress yourself and after we have sex
Don't stress yourself cuz i still respect you
If you respect yourself girl it's whatever I get da
Chedda when we get together it don't be no better
And you can see I'm throwin' it cuz my arm
On chill it look like i spilled freon on it
I make hella paper on da block that's why I'm bout
To put a three story elevator in my yacht they goin
Keep hatin it boo, but keep holdin' me
Down strong dis song dedicated to you
How ya doin ma
(oh)
Dis ya song ma
(yeah)
Yeah come on ma
(oh)
Dis ya song Ma
(yeah)
We can get it on ma
(oh)
Dis ya song ma
Dis ya song ma
Dis ya son
(Yeah) yeah, yeah, yeah
Scream at me
Me and you
(it don't get no better)
What we can do
(it don't get no better)
Our love
(it don't get no better)
Cuz you remind me of the first time

(Mashonda:)
Baby I can't deny that I'm feelin you
The way that you look and the things you do
Knowing, knowing baby it don't whoa oh whoa
It don't get no better

(Chorus w/ Mashonda:)
How ya doin ma
(oh)
Dis ya song ma
(yeah)
Yeah come on ma
(oh)
Dis ya song Ma
(yeah)
We can get it on ma
(oh)
Dis ya song ma
Dis ya song ma
Dis ya son
(Yeah) yeah, yeah, yeah
Scream at me
Me and you
(it don't get no better)
What we can do
(it don't get no better)
Our love
(it don't get no better)
Cuz you remind me of the first time

(Chorus w/ Mashonda:)
How ya doin ma
(oh)
Dis ya song ma
(yeah)
Yeah come on ma
(oh)
Dis ya song Ma
(yeah)
We can get it on ma
(oh)
Dis ya song ma
Dis ya song ma
Dis ya son
(Yeah) yeah, yeah, yeah
Scream at me
Me and you
(it don't get no better)
What we can do
(it don't get no better)
Our love
(it don't get no better)
Cuz you remind me of the first time

I go by the name of cassidy ""da problem"", me and mashonda

(song fades out)EmbedShare URLCopyEmbedCopy"
