,Unnamed: 0,artist,track,genres,lyrics
132,132,Ja Rule Featuring Bobby Brown,Thug Lovin',"['dance pop', 'east coast hip hop', 'gangster rap', 'hip hop', 'hip pop', 'pop rap', 'queens hip hop', 'rap', 'urban contemporary', 'funk', 'hip hop', 'new jack swing', 'quiet storm', 'r&b', 'rap', 'urban contemporary']","[Intro: Ja Rule (Bobby Brown)]
What up, Gotti? Yeah
This is how it's goin down, nigga, Rule, baby
(All we need is a a stage, God, shit)
Ha-ha, yeah, yeah, yeah
(Yeah, come on, ha-ha-ha)
It's on and popping, baby (Ooh)
The Last Temptation, The Last Temptation, ha-ha
He's back (Woo!)
Y'all know who I'm talking about (ooh)
To the world over (Oh, oh), B. Brown
[Chorus: Bobby Brown]
And I know you're getting bored (Come on, come on)
Dealing with him (What? Come on, ha-ha) (Him)
I know you miss my loving, my thugging
Thug loving
And I know you're getting bored
Dealing with him
I know you miss my loving, my thugging
Thug loving
And I know you're getting bored, baby

[Verse 1: Ja Rule, Bobby Brown & Both]
I know you're living your life faithfully, safely, away from me (Woo!) But you miss being next to me, don't you?
Don't let her love haunt you, lust for what you want
Go for your guns and back out on anyone who tries to interfere
Or intervene
Of me peeling your wide body out of them tight jeans
Wrist on freeze, see it's on me
Shoes 19, coming through in that new Bentley thing (GIRL!!)
The talk of the town, the tease of the city (yeah)
You and I make headlines like Lo and Diddy or Bob and Whitney (WHO?)
I'm here 'cause the Lord sent me (WHO?), pound puss like a pugilist
Grin real devilish and freak bad bitches (oh-ohh)
Forget the story, I know you're getting bored
And that nigga ain't getting you horny no more, is he?
'Cause when it's all said and done, it's me
Loving, thugging you, baby...
[Chorus: Bobby Brown]
And I know you're getting bored
Dealing with him
I know you miss my loving, my thugging
Thug loving (woo!)
And I know you're getting bored
Dealing with him
I know you miss my loving, my thugging
Thug loving
And I know you're getting bored, baby

[Verse 2: Ja Rule, Bobby Brown & Both]
Sweet thing, living it
Won't you let me let you live it a little bit
I know a stressful relationship is hard to deal with
But here's how to deal with it
On your weekly visits
Use a code name to protect the innocent (ha)
Maybe I'm too generous
Generally believing that all women want me
They don't wanna get even (girl, I know)
But who do you believe in
Is it money or God?
Betrayal, trust, this thing of ours  (GIRL!!)
Should be secretly held sacred, 'cause I love it when you pop your body-body
And move your body-body
Drink up on the Bacardi and rub up alongside me
I love to see you wild and free
But occasionally you get cold wet feet
And all that it means to me is you need my heat (Ja!)
'Cause when it's said and done you're gonna want me
Loving, thugging you, baby...
[Chorus: Bobby Brown (Ja Rule)]
And I know you're getting bored
Dealing with him
I know you miss my loving, my thugging
Thug loving (thug shit)
And I know you're getting bored (know you're getting bored)
Dealing with him (dealing with him)
I know you miss my loving, my thugging
Thug loving
And I know you're getting bored, baby

[Verse 3: Ja Rule, Bobby Brown & Both]
Rule, baby
Baby girl, here I'm holding your love hostage
The ransom for you, sugar, be priceless (WOOOO!!!)
'Cause you been getting at me in many a ways
Now tell your man to watch his back and duck from strays
'Cause I been in a rage (GIRL!!) lately (yeah)
Hoping God'll forgive me for all the sin, all the women
All the drama I been in and it's just the beginning (WOOOO!!!)
I hope you (watch) so you could see that nigga ain't built like me (like me)
Black Sheep of the family
But we one in the same, that's why we get along
Freak off and get it on
When we make love looking something like soft porn
Now tell me, baby, do you really wanna go home to him?
Where the brightest of days just look dim
And you fucking with a loser, baby, you can't win (HA, HA)
When it's said and done you're gonna need me
Loving, thugging you, baby...
[Chorus: Bobby Brown (Ja Rule)]
And I know you're getting bored
Dealing with him
I know you miss my loving, my thugging (Rule, B. Brown)
Thug loving (ha)
And I know you're getting bored (know you're getting bored)
Dealing with him (dealing with him)
I know you miss my loving, my thugging (WOOO!!!)
Thug loving
And I know you're getting bored, baby

[Outro: Ja Rule (Bobby Brown)]
Yeah, yeah
I.G., Ja Rule (I know you miss my loving)
B. Brown, (my, ha) my nigga Chink Santana
Murder Inc., niggas
(And I know you're getting bored)
Def Jam, Sony
This is what we building here
Classic shit! Murder Inc.! Nigga
(Ha-ha-ha, JA!! B. Brown, Murdddda, ha-ha)
It's that real shit
The Rule, baby
Bringing back my nigga
B. Brown, ha-ha
(I know you're getting bored
Dealing with him)EmbedShare URLCopyEmbedCopy"
133,133,Birdman Featuring Lil Wayne & Drake,Money To Blow,"['dirty south rap', 'gangster rap', 'hip hop', 'pop rap', 'rap', 'southern hip hop', 'hip hop', 'new orleans rap', 'pop rap', 'rap', 'trap', 'canadian hip hop', 'canadian pop', 'hip hop', 'pop rap', 'rap', 'toronto rap']","[Intro: Birdman & Drake]
Richer than the richest
More money, bitches
Yeah, coming to you live from the city of Houstatlantavegas
So what it do young nigga? One hundred

[Verse 1: Drake]
I am on a 24-hour champagne diet
Spilling while I'm sipping, I encourage you to try it
I'm probably just saying that cause I don't have to buy it
The club owner supply it, boy, I'm on that fly shit
I am what everybody in my past don't want me to be
Guess what? I made it!
I'm the motherfuckin' man, I just want you to see
Come take a look, get a load of this nigga
Quit fronting on me, don't come around
And try and gas me up, I like running on E
I, I-I-I'm on my Disney shit - Goofy flow
On records I'm Captain Hook, and my new car is ""Rufio""
Damn, where my roof just go?
I'm somebody that you should know
Get to shakin' somethin' cause that's what Drumma produced it for
Yes I make mistakes that I don't ever make excuses for
Like leaving girls that love me, and constantly seducing hoes
I'm losing my thoughts, I said ""Damn, where my roof just go?""
Top slipped off like Janet at the Super Bowl
[Chorus: Drake]
They can't help it and I can't blame 'em
Since I got famous, but bitch, I got money to blow
I'm getting it in
Letting these bills fall all over your skin
I got money to blow, oh, I got money to blow

[Verse 2: Birdman]
(Cash Money millionaires)
Yeah, richer than the richest, we certified getting it
CM, YM, Cash Money business
Higher than the ceiling, fly like a bird
Hit the Gucci store and later get served
We smoked out, with no roof on it
Them people passing, so we smash on 'em
Ballin' out, we keep the cash on deck
Lamborghinis and them Bentleys on the V-set
Louis lens iced up with the black diamonds
Cartier, Ferrari, the new Spider
No lie, I'm higher than I ever been
Born rich, born Uptown, born to win
Fully loaded, automatic 6 Benz
Candy paint, foreign lights with my bitch in
Born hustling, too big nigga to size me up
Kept stuntin', more money, burnin' up
[Chorus: Drake]
They can't help it and I can't blame 'em
Since I got famous, but bitch, I got money to blow
I'm getting it in
Letting these bills fall all over your skin
I got money to blow, oh, I got money to blow

[Verse 3: Lil Wayne]
Well I get paid every 24 hours
Money and the power
Come-come to V.I.P. and get a champagne shower
I don't have to worry because everything ours
And I got a big bouquet of Mary Jane's flowers
That kush
I promise that's my dude
But we don't smoke that Reggie Bush
And I'm with two women
Make you take a second look
We popping like champagne bottles
But we never shook
And we gon' be alright if we put Drake on every hook

[Chorus: Drake]
They can't help it and I can't blame 'em
Since I got famous, but bitch, I got money to blow
I'm getting it in
Letting these bills fall all over your skin
I got money to blow, oh, I got money to blow22EmbedShare URLCopyEmbedCopy"
134,134,Trick Daddy Featuring LaTocha Scott,Thug Holiday,"['crunk', 'dirty south rap', 'gangster rap', 'hip hop', 'hip pop', 'miami hip hop', 'pop rap', 'rap', 'southern hip hop', 'trap']","[Intro]
Thug holiday, go ahead you can cry this up right baby
Everything gone be gravy later, that's right
This the time when we take time to remember
All the loved ones we lost in the struggle you know
I dedicate this to my brother Hollywood, Toby, Bam
My dog Itchy and Lil Trav, I dedicate this to the struggle
Everybody in the county jail, state penn, check it out

[Trick Daddy]
If it wasn't for bad luck, hell I guess that a nigga wouldn't have none
But when I think about it, what would I be without my gun
How could I, get away from the po-po's, if a, nigga couldn't run
And how was I given a daughter when I always prayed for a son
Life is crazy ain't it, sometimes I even think the same thing
I've been waiting on freeing the ring hell but ain't a thang changed
And I lost my brother in the struggle, Taterhead done lost his mother
And I'm thinking about it who's mine's who gone raise my brother
Not to be a thug, stay in school, don't use drugs
Who'll teach him right from wrong and show them boys, true love
So I pray for the better days, face the bomb had a run-a-ways
And, I put my guns away and I pray for peace on Sundays, it's crazy ain't it

[Hook: LaTocha Scott]
Just like the soldiers, that ain't coming home this year
Just like the fellas, in prison, we miss you so much for real
What about the children, who ran away, that ain't coming home today
Well here's a message from coast to coast
Cause when them thugs really need it the most a thug holiday
Just like 'em, just like 'em, just like 'em, a thug holiday - 2x

[Trick Daddy]
Here go one for, all these killings and all these conflicts in religion
See the Muslims, Jews and Christians but know they are all God's children
There's only, one him, plus ain't none of y'all confronting him
So blind in our own minds we wouldn't even know God if we was in front of him
And, I read your books know all your remixes to the bible
What about a, verse for the thugs curled with drugs and survival
That's asking chapels naming Martin, Malcolm and Farrakhan
In all my history books, only one died was the Americans
And, that's point of my, who's responsible for Vietnam
And, hold on there's more, we had two World Wars
And, how come the judges make more than the teachers is making
When they the ones raising all the taxes and got us fighting for education
Life is crazy ain't it

[Hook]
So many tears, through out the years
Somebody tell me what's going on
And so many liiives, but only God knows
About the pain deep inside
It gets so hard, you got to keep your head up
I know you're fed up, but stay strong
Here's a message from coast to coast
Cause when them thugs really need it the most, thug holiday
Just like 'em, just like 'em, just like 'em, a thug holiday - 2x

[LaTocha Scott]
This is for my people in the ghetto
I'm calling out, calling out
To all my thugs in the ghetto
Calling out, calling out
It gets hard sometimes, but you
Got to keep your head up, and be strong
Here's a message from coast to coast
Cause when them thugs really need it the most, a thug holiday

(*ad-libs*)1EmbedShare URLCopyEmbedCopy"
135,135,Jennifer Hanson,Beautiful Goodbye,['country dawn'],"It's like the most amazing sunset
You've ever seen
There's never another quite the same
It just falls into some eternal sea
Like the end of a movie that makes you cry
You're sad when it's over
But you're glad you had
That moment that moved you deep inside

Beautiful goodbye, baby, goodbye
I enjoyed the ride
We really had us a time
It's a strange kinda high
A beautiful goodbye

I'm standing here watching you drive away
We were so grown up about it all
But how will it look in the light of day?
I miss you already, but don't turn around
It's funny how you know when it just won't work
And how letting go can make the sweetest sound

Beautiful goodbye, baby, goodbye
I enjoyed the ride
We really had us a time
It's a strange kinda high
A beautiful goodbye
So ironic, it's so confusing
To do the right thing and be losin
I'm always stuck with choosin
Ain't that just like life?

Hey yeah
Hey yeah yeah

Beautiful goodbye, baby, goodbye
I enjoyed the ride
We really had us a time
It's a strange kinda high
A beautiful goodbye
Goodbye, yeah

Na na na na, na na na na
Na na na na na na goodbye
Na na na na, na na na na
Na na na na na na goodbyeEmbedShare URLCopyEmbedCopy"
136,136,Faith Hill,The Way You Love Me,"['contemporary country', 'country', 'country dawn', 'country road', 'dance pop']","[Verse 1]
If I could grant you one wish
I'd wish you could see the way you kiss
Ooh, I love watching you, baby
When you're driving me crazy

[Chorus]
Ooh, I love the way you (You laugh and breathe)
Love the way you love me (And smile when you touch me)
There's nowhere else I'd rather be (Drives me wild)
Ooh, to feel the way I feel with your arms around me (I melt and spin and fall again)
I only wish that you could see
The way you love me (Love me)
Whoa, whoa, whoa, the way you love me

[Verse 2]
It's not right
It's not fair
What you're missing over there
Someday I'll find a way to show you
Just how lucky I am to know you

[Chorus]
Ooh, I love the way you (You laugh and breathe)
Love the way you love me (And smile when you touch me)
There's nowhere else I'd rather be (Drives me wild)
Ooh, to feel the way I feel with your arms around me (I melt and spin and fall again)
I only wish that you could see
The way you love me (Love me)
Whoa, whoa, whoa, the way you love me
[Bridge]
You're the million reasons why there's love reflecting in my eyes

[Chorus]
Ooh, I love the way you (You laugh and breathe)
Love the way you love me (And smile when you touch me)
There's nowhere else I'd rather be (Drives me wild)
Ooh, to feel the way I feel with your arms around me (I melt and spin and fall again)
I only wish that you could see
The way you love me (Love me)
Whoa, whoa, whoa, the way you love me (Love me)
Whoa, whoa, whoa, the way you love me (Love me)
Whoa, whoa, whoa, the way you love me

[Outro]
Oh, the way you love me
Ooh, I love the way you love me
The way you love me
Ooh, I love the way you love me
Oh yeah
Ooh, I love the way you love me
Whoa, whoa, whoa (Yeah)2EmbedShare URLCopyEmbedCopy"
137,137,O-Town,These Are The Days,"['boy band', 'dance pop']","[Verse 1]
Motel, sitting in the dark
Empty room like an empty heart
Lovers stop, but they never stay
They don't look back as they drive away
Maybe I can fix this broken neon light
Fill in the cracks and paint it bright
That maybe love will stop here tonight

[Pre-Chorus]
And if she knocks on my door
I'll give her the key
Just one look in her eyes
And I know I'll be everything that she sees in me
More than I ever thought I could be, but...

[Chorus]
These are the days
When all that I can do is dream
But I don't wanna spend forever
Living in the in-between
I'm stuck here in a place without love
And I just can't let it stay this way
But for now, I'm gonna have to face it
These are the days
[Verse 2]
I gotta use this lonely time
To change the picture in my frame of mind
Outside the window, there's a sunny day
I wanna feel it on my face
You and I
We're out here looking for the same thing
An end to all the wondering
Waiting for someone to share this feeling

[Pre-Chorus]
And if she knocks on my door
I'll give her the key
Just one look in her eyes
And I know I'll be
Everything that she sees in me
More than I ever thought I could be, but...

[Chorus]
These are the days
When all that I can do is dream
But I don't wanna spend forever
Living in the in-between
I'm stuck here in a place without love
And I just can't let it stay this way
But for now, I'm gonna have to face it
These are the days
[Bridge]
These are the days between your hopes and fears
These are the moments that are still unclear
It's still uncertain if she will appear
But like it or not, this is what I got
Oh, but

[Chorus]
These are the days
When all that I can do is dream
But I don't wanna spend forever
Living in the in-between
And I'm stuck here in a place without love
And I just can't let it stay this way
But for now, I'm gonna have to face it
'Cause these are the days
These are the days
When all that I can do is dream
But I don't wanna spend forever
Living in the in-between
I'm stuck here in a place without love
And I just can't let it stay this way
But for now, I'm gonna have to face it
These are the daysEmbedShare URLCopyEmbedCopy"
138,138,The Red Jumpsuit Apparatus,Face Down,"['emo', 'pop punk', 'pop rock', 'screamo']","[Verse 1]
Hey girl, you know you drive me crazy
One look puts the rhythm in my hand
Still, I'll never understand why you hang around
I see what's going down
Cover up with makeup in the mirror
Tell yourself, ""It's never gonna happen again""
You cry alone, and then
He swears he loves you

[Chorus]
Do you feel like a man when you push her around?
Do you feel better now, as she falls to the ground?
Well, I'll tell you my friend, one day this world's going to end
As your lies crumble down, a new life she has found

[Verse 2]
A pebble in the water makes a ripple effect
Every action in this world'll bear a consequence
If you wade around forever, you will surely drown
I see what's going down

[Pre-Chorus]
I see the way you go and say you're right again
Say you're right again, heed my lecture
[Chorus]
Do you feel like a man when you push her around?
Do you feel better now as she falls to the ground?
Well, I'll tell you my friend, one day this world's going to end
As your lies crumble down, a new life she has found

[Post-Chorus]
Face down in the dirt, she said, ""This doesn't hurt""
She said, ""I finally had enough""
Face down in the dirt, she said, ""This doesn't hurt""
She said, ""I finally had enough""

[Bridge]
One day she will tell you that she has had enough
It’s coming 'round again

[Chorus]
Do you feel like a man when you push her around?
Do you feel better now as she falls to the ground?
Well, I'll tell you my friend, one day this world's going to end
As your lies crumble down, a new life she has found
Do you feel like a man when you push her around?
Do you feel better now as she falls to the ground?
Well, I'll tell you my friend, one day this world's going to end
As your lies crumble down, a new life she has found
[Post-Chorus]
Face down in the dirt, she said, ""This doesn't hurt""
She said, ""I finally had enough""31EmbedShare URLCopyEmbedCopy"
139,139,Nickelback,If Today Was Your Last Day,"['alternative metal', 'canadian rock', 'nu metal', 'post-grunge']","[Verse 1]
My best friend gave me the best advice
He said each day's a gift and not a given right
Leave no stone unturned, leave your fears behind
And try to take the path less traveled by
That first step you take is the longest stride
(What if, what if?)

[Chorus 1]
If today was your last day
And tomorrow was too late
Could you say goodbye to yesterday? (What if, what if?)
Would you live each moment like your last?
Leave old pictures in the past?
Donate every dime you have?
(What if, what if?)
If today was your last day
(What if, what if?)
(If today was your last day)

[Verse 2]
Against the grain should be a way of life
What's worth the prize is always worth the fight
Every second counts 'cause there's no second try
So live like you'll never live it twice
Don't take the free ride in your own life
(What if, what if?)
[Chorus 2]
If today was your last day
And tomorrow was too late
Could you say goodbye to yesterday? (What if, what if?)
Would you live each moment like your last?
Leave old pictures in the past?
Donate every dime you have? (What if, what if?)
And would you call old friends you never see?
Reminisce old memories?
Would you forgive your enemies? (What if, what if?)
Would you find that one you're dreamin' of?
Swear up and down to God above
That you finally fall in love? (That you finally fall in love)
If today was your last day

[Bridge]
If today was your last day
Would you make your mark by mending a broken heart?
You know it's never too late to shoot for the stars
Regardless of who you are
So do whatever it takes (Takes)
'Cause you can't rewind a moment in this life
Let nothin' stand in your way (Way)
'Cause the hands of time are never on your side

[Chorus 2]
If today was your last day
And tomorrow was too late
Could you say goodbye to yesterday?
Would you live each moment like your last?
Leave old pictures in the past?
Donate every dime you have? (What if, what if?)
And would you call old friends you never see?
Reminisce old memories?
Would you forgive your enemies? (What if, what if?)
Would you find that one you're dreamin' of?
Swear up and down to God above
That you finally fall in love? (What if, what if?)
If today was your last day18EmbedShare URLCopyEmbedCopy"
140,140,AFI,Miss Murder,"['alternative metal', 'emo', 'pop punk', 'punk', 'screamo', 'skate punk']","[Chorus]
Hey (Hey!) Miss Murder, can I, hey (Hey!) Miss Murder, can I
Make (Hey!) beauty stay if I take my life? Ho-oh-oh

[Verse 1]
With just a look, they shook, and heavens bowed before him
Simply a look can break your heart
The stars that pierce the sky, he left them all behind
We’re left to wonder why he left us all behind

[Chorus]
Hey (Hey!) Miss Murder, can I, hey (Hey!) Miss Murder, can I
Make (Hey!) beauty stay if I take my life? Ho-oh-oh

[Verse 2]
Dreams of his crash won’t pass, oh, how they all adored him
Beauty will last when spiraled down
The stars that mystify, he left them all behind
And how his children cried, ""He left us all behind!""

[Chorus]
Hey (Hey!) Miss Murder, can I, hey (Hey!) Miss Murder, can I
Make (Hey!) beauty stay if I take my life? Ho-oh-oh...

[Bridge]
What's the hook, the twist within this verbose mystery?
I would gladly bet my life upon it
That the ghost you love, your ray of light will fizzle out
Without hope
We're the empty set just floating through empty skin
Ever searching for what we were promised
Reaching for that golden ring, we'd never let go
But who would ever let us put our filthy hands upon it?
[Chorus]
Hey (Hey!) Miss Murder, can I, hey (Hey!) Miss Murder, can I
Make (Hey!) beauty stay if I take my life? Ho-oh-oh
Hey (Hey!) Miss Murder, can I, hey (Hey!) Miss Murder, can I
Make (Hey!) beauty stay if I take my life? Oh-oh!23EmbedShare URLCopyEmbedCopy"
141,141,Shakira Featuring Alejandro Sanz,La Tortura,"['colombian pop', 'dance pop', 'latin', 'latin pop', 'pop', 'cantautor', 'latin', 'latin arena pop', 'latin pop', 'mexican pop', 'rock en espanol', 'spanish pop']","[Letra de ""La Tortura"" ft. Alejandro Sanz]

[Intro: Alejandro Sanz]
Ay payita mia, guardate la poesia
Guardate la alegria pa' ti

[Verso 1: Shakira & Alejandro Sanz]
No pido que todos los días sean de sol
No pido que todos los viernes sean de fiesta
Tampoco te pido que vuelvas rogando perdón
Si lloras con los ojos secos
Y hablando de ella
Ay, amor, me duele tanto (Me duele tanto)
Que te fueras sin decir a dónde
Ay, amor, fue una tortura perderte

[Coro: Shakira & Alejandro Sanz]
Yo sé que no he sido un santo
Pero lo puedo arreglar, amor
No sólo de pan vive el hombre
Y no de excusas vivo yo
Sólo de errores se aprende
Y hoy sé que es tuyo mi corazón
Mejor te guardas todo eso
A otro perro con ese hueso
Y nos decimos adios
[Verso 2: Shakira & Alejandro Sanz]
No puedo pedir que el invierno perdone a un rosal
No puedo pedir a los olmos que entreguen peras
No puedo pedirle lo eterno a un simple mortal
Y andar arrojando a los cerdos miles de perlas
Ay, amor, me duele tanto, me duele tanto
Que no creas más en mis promesas
Ay, amor, es una tortura perderte

[Coro: Shakira & Alejandro Sanz]
Yo sé que no he sido un santo
Pero lo puedo arreglar, amor
No sólo de pan vive el hombre
Y no de excusas vivo yo
Sólo de errores se aprende
Y hoy sé que es tuyo mi corazón
Mejor te guardas todo eso
A otro perro con ese hueso
Y nos decimos adiós

[Verso 3: Alejandro Sanz]
No te bajes, no te bajes
Oye negrita, mira, no te rajes
De lunes a viernes tienes mi amor
Déjame el sábado a mi que es mejor
Oye mi negra, no me castigues más
Porque allá afuera, sin ti no tengo paz
Yo sólo soy un hombre muy arrepentido
Soy como el ave que vuelve a su nido
[Coro: Shakira & Alejandro Sanz]
Yo sé que no he sido un santo
Es que no estoy hecho de cartón
No solo de pan vive el hombre
Y no de excusas vivo yo
Sólo de errores se aprende
Y hoy sé que es tuyo mi corazón

[Outro: Shakira]
Ay, ay, ay, ay, ay, ay
Ay todo lo que he hecho por ti
Fue una tortura perderte
Me duele tanto que sea así
Sigue llorando, perdón
Yo ya no voy a llorar hoy por ti23EmbedShare URLCopyEmbedCopy"
